{
    "name": "HCP AFI",
    "description": "Human Connectome Project Structural Session AFI scan (Actual Flip-angle Imaging for B1 field mapping)",
    "authors": [
        "WU-Minn Consortium"
    ],
    "acquisitions": {
        "acq-afi": {
            "fields": [
                {
                    "field": "SeriesDescription",
                    "value": "AFI"
                },
                {
                    "field": "SequenceName",
                    "value": "*fl3d1"
                },
                {
                    "field": "Manufacturer",
                    "value": "SIEMENS"
                },
                {
                    "field": "ManufacturerModelName",
                    "value": "MAGNETOM ConnectomS"
                },
                {
                    "field": "SoftwareVersions",
                    "value": "syngo MR D11"
                },
                {
                    "field": "MRAcquisitionType",
                    "value": "3D"
                },
                {
                    "field": "SliceThickness",
                    "value": 2.00
                },
                {
                    "field": "PixelSpacing",
                    "value": [
                        2.0,
                        2.0
                    ]
                },
                {
                    "field": "Rows",
                    "value": 128
                },
                {
                    "field": "Columns",
                    "value": 128
                },
                {
                    "field": "AcquisitionMatrix",
                    "value": [
                        0,
                        128,
                        128,
                        0
                    ]
                },
                {
                    "field": "RepetitionTime",
                    "value": 70.0
                },
                {
                    "field": "EchoTime",
                    "value": 1.90
                },
                {
                    "field": "FlipAngle",
                    "value": 50
                },
                {
                    "field": "PixelBandwidth",
                    "value": 450
                },
                {
                    "field": "InPlanePhaseEncodingDirection",
                    "value": "COL"
                },
                {
                    "field": "PhaseEncodingDirectionPositive",
                    "value": [
                        0
                    ]
                },
                {
                    "field": "NumberOfPhaseEncodingSteps",
                    "value": 128
                },
                {
                    "field": "SliceOversampling",
                    "value": 9.1
                },
                {
                    "field": "MagneticFieldStrength",
                    "value": 3
                },
                {
                    "field": "ImagingFrequency",
                    "value": 123.254038
                },
                {
                    "field": "ImagedNucleus",
                    "value": "1H"
                },
                {
                    "field": "TransmitCoilName",
                    "value": "Body"
                },
                {
                    "field": "ReceiveCoilName",
                    "value": "HEA;HEP"
                },
                {
                    "field": "NumberOfAverages",
                    "value": 1
                },
                {
                    "field": "PercentSampling",
                    "value": 100
                },
                {
                    "field": "PercentPhaseFieldOfView",
                    "value": 100.0
                },
                {
                    "field": "AcquisitionDuration",
                    "value": 268
                },
                {
                    "field": "NumberOfSlabGroups",
                    "value": 1
                },
                {
                    "field": "SlabsPerGroup",
                    "value": 1
                },
                {
                    "field": "SlicesPerSlab",
                    "value": 88
                },
                {
                    "field": "SliceSpacing",
                    "value": 2.4
                },
                {
                    "field": "ImageOrientationPatient",
                    "value": "Sagittal"
                },
                {
                    "field": "MultiSliceMode",
                    "value": "Interleaved"
                },
                {
                    "field": "ScanningSequence",
                    "value": [
                        "GR"
                    ]
                },
                {
                    "field": "SequenceVariant",
                    "value": [
                        "SP"
                    ]
                },
                {
                    "field": "ParallelAcquisitionTechnique",
                    "value": "GRAPPA"
                },
                {
                    "field": "ParallelReductionFactorInPlane",
                    "value": 3
                },
                {
                    "field": "ParallelReductionFactorOutOfPlane",
                    "value": 3
                },
                {
                    "field": "GRAPPAKernelSize",
                    "value": 24
                },
                {
                    "field": "GRAPPAKernelSize3D",
                    "value": 24
                },
                {
                    "field": "SliceResolution",
                    "value": 100
                },
                {
                    "field": "AsymmetricEcho",
                    "value": "Off"
                },
                {
                    "field": "AutoAlign",
                    "value": "Head > Brain"
                },
                {
                    "field": "PatientPosition",
                    "value": "Isocenter"
                },
                {
                    "field": "CoilCombineMode",
                    "value": "Sum of Squares"
                },
                {
                    "field": "RFSpoiling",
                    "value": "On"
                },
                {
                    "field": "AveragingMode",
                    "value": "Short term"
                },
                {
                    "field": "GradientMode",
                    "value": "Fast"
                },
                {
                    "field": "RFPulseType",
                    "value": "Normal"
                },
                {
                    "field": "Excitation",
                    "value": "Non-sel."
                },
                {
                    "field": "EllipticalScanning",
                    "value": "Off"
                },
                {
                    "field": "PhaseStabilisation",
                    "value": "Off"
                },
                {
                    "field": "Reordering",
                    "value": "Linear"
                },
                {
                    "field": "RelativeROSpoilerMoment",
                    "value": 20.00
                },
                {
                    "field": "Relative3DSpoilerMoment",
                    "value": 40.00
                },
                {
                    "field": "DualTRB1Mapping",
                    "value": "On"
                },
                {
                    "field": "TROffset",
                    "value": 50000
                },
                {
                    "field": "DualTRSpoilerRatio",
                    "value": 0.170
                },
                {
                    "field": "DummyScanDuration",
                    "value": 2000
                },
                {
                    "field": "PrescanNormalize",
                    "value": "Off"
                },
                {
                    "field": "MultipleSeriesMode",
                    "value": "Each measurement"
                },
                {
                    "field": "ShimMode",
                    "value": "Standard"
                },
                {
                    "field": "AutoCoilSelect",
                    "value": "Default"
                }
            ],
            "series": [
                {
                    "name": "1",
                    "fields": [
                        {
                            "field": "ImageType",
                            "value": [
                                "ORIGINAL",
                                "PRIMARY",
                                "M",
                                "ND"
                            ]
                        },
                        {
                            "field": "SeriesNumber",
                            "value": 1
                        }
                    ]
                }
            ]
        }
    }
}