{
    "name": "HCP BOLD_RL_SB_SE",
    "description": "Human Connectome Project Functional Session SpinEchoFieldMap_RL scan for distortion correction",
    "authors": [
        "WU-Minn Consortium"
    ],
    "acquisitions": {
        "acq-spinechofieldmap-rl": {
            "fields": [
                {
                    "field": "SeriesDescription",
                    "value": "SpinEchoFieldMap_RL"
                },
                {
                    "field": "SequenceName",
                    "value": "cmrr_mbep2d_se"
                },
                {
                    "field": "Manufacturer",
                    "value": "SIEMENS"
                },
                {
                    "field": "ManufacturerModelName",
                    "value": "MAGNETOM ConnectomS"
                },
                {
                    "field": "SoftwareVersions",
                    "value": "syngo MR D11"
                },
                {
                    "field": "MRAcquisitionType",
                    "value": "2D"
                },
                {
                    "field": "SliceThickness",
                    "value": 2.0
                },
                {
                    "field": "PixelSpacing",
                    "value": [
                        2.0,
                        2.0
                    ]
                },
                {
                    "field": "Rows",
                    "value": 104
                },
                {
                    "field": "Columns",
                    "value": 90
                },
                {
                    "field": "AcquisitionMatrix",
                    "value": [
                        90,
                        0,
                        0,
                        104
                    ]
                },
                {
                    "field": "RepetitionTime",
                    "value": 7060
                },
                {
                    "field": "EchoTime",
                    "value": 58.0
                },
                {
                    "field": "FlipAngle",
                    "value": 90
                },
                {
                    "field": "RefocusFlipAngle",
                    "value": 180
                },
                {
                    "field": "EchoSpacing",
                    "value": 0.58
                },
                {
                    "field": "EPIFactor",
                    "value": 90
                },
                {
                    "field": "PixelBandwidth",
                    "value": 2290
                },
                {
                    "field": "InPlanePhaseEncodingDirection",
                    "value": "ROW"
                },
                {
                    "field": "PhaseEncodingDirectionPositive",
                    "value": [
                        0
                    ]
                },
                {
                    "field": "NumberOfPhaseEncodingSteps",
                    "value": 90
                },
                {
                    "field": "MagneticFieldStrength",
                    "value": 3
                },
                {
                    "field": "ImagingFrequency",
                    "value": 123.254038
                },
                {
                    "field": "ImagedNucleus",
                    "value": "1H"
                },
                {
                    "field": "TransmitCoilName",
                    "value": "Body"
                },
                {
                    "field": "ReceiveCoilName",
                    "value": "HEA;HEP"
                },
                {
                    "field": "NumberOfAverages",
                    "value": 1
                },
                {
                    "field": "PercentSampling",
                    "value": 100
                },
                {
                    "field": "PercentPhaseFieldOfView",
                    "value": 86.5
                },
                {
                    "field": "AcquisitionDuration",
                    "value": 28
                },
                {
                    "field": "NumberOfSliceGroups",
                    "value": 1
                },
                {
                    "field": "SlicesPerGroup",
                    "value": 72
                },
                {
                    "field": "SliceSpacing",
                    "value": 2.0
                },
                {
                    "field": "ImageOrientationPatient",
                    "value": "T > C-20.0"
                },
                {
                    "field": "MultiSliceMode",
                    "value": "Interleaved"
                },
                {
                    "field": "ScanningSequence",
                    "value": [
                        "EP"
                    ]
                },
                {
                    "field": "SequenceVariant",
                    "value": [
                        "SK"
                    ]
                },
                {
                    "field": "MultibandAccelerationFactor",
                    "value": 1
                },
                {
                    "field": "FakeMBFactorForSB",
                    "value": 8
                },
                {
                    "field": "InvertROPEPolarity",
                    "value": "Off"
                },
                {
                    "field": "AutoAlign",
                    "value": "Head > Brain"
                },
                {
                    "field": "PatientPosition",
                    "value": "L0.0 P3.0 H6.0 mm"
                },
                {
                    "field": "CoilCombineMode",
                    "value": "Sum of Squares"
                },
                {
                    "field": "AveragingMode",
                    "value": "Long term"
                },
                {
                    "field": "GradientMode",
                    "value": "Fast"
                },
                {
                    "field": "RFPulseType",
                    "value": "Normal"
                },
                {
                    "field": "FatSuppression",
                    "value": "Fat sat."
                },
                {
                    "field": "FatSatMode",
                    "value": "Weak"
                },
                {
                    "field": "Measurements",
                    "value": 3
                },
                {
                    "field": "DelayInTR",
                    "value": 0
                },
                {
                    "field": "PrescanNormalize",
                    "value": "Off"
                },
                {
                    "field": "ShimMode",
                    "value": "Standard"
                },
                {
                    "field": "AutoCoilSelect",
                    "value": "Default"
                },
                {
                    "field": "UseTriggeringParadigm",
                    "value": "Off"
                }
            ],
            "series": [
                {
                    "name": "1",
                    "fields": [
                        {
                            "field": "ImageType",
                            "value": [
                                "ORIGINAL",
                                "PRIMARY",
                                "EPI",
                                "M",
                                "ND"
                            ]
                        },
                        {
                            "field": "SeriesNumber",
                            "value": 1
                        }
                    ]
                }
            ]
        }
    }
}