{
    "name": "HCP T2w_SPC1",
    "description": "Human Connectome Project Structural Session T2-weighted SPACE first acquisition",
    "authors": [
        "WU-Minn Consortium"
    ],
    "acquisitions": {
        "acq-t2w-spc1": {
            "fields": [
                {
                    "field": "SeriesDescription",
                    "value": "T2w_SPC1"
                },
                {
                    "field": "SequenceName",
                    "value": "*spc3d1"
                },
                {
                    "field": "Manufacturer",
                    "value": "SIEMENS"
                },
                {
                    "field": "ManufacturerModelName",
                    "value": "MAGNETOM ConnectomS"
                },
                {
                    "field": "SoftwareVersions",
                    "value": "syngo MR D11"
                },
                {
                    "field": "MRAcquisitionType",
                    "value": "3D"
                },
                {
                    "field": "SliceThickness",
                    "value": 0.70
                },
                {
                    "field": "PixelSpacing",
                    "value": [
                        0.7,
                        0.7
                    ]
                },
                {
                    "field": "Rows",
                    "value": 320
                },
                {
                    "field": "Columns",
                    "value": 320
                },
                {
                    "field": "AcquisitionMatrix",
                    "value": [
                        0,
                        320,
                        320,
                        0
                    ]
                },
                {
                    "field": "RepetitionTime",
                    "value": 3200
                },
                {
                    "field": "EchoTime",
                    "value": 565.0
                },
                {
                    "field": "FlipAngleMode",
                    "value": "T2 var"
                },
                {
                    "field": "EchoSpacing",
                    "value": 3.53
                },
                {
                    "field": "TurboFactor",
                    "value": 314
                },
                {
                    "field": "EchoTrainDuration",
                    "value": 1105
                },
                {
                    "field": "PixelBandwidth",
                    "value": 744
                },
                {
                    "field": "InPlanePhaseEncodingDirection",
                    "value": "COL"
                },
                {
                    "field": "PhaseEncodingDirectionPositive",
                    "value": [
                        0
                    ]
                },
                {
                    "field": "NumberOfPhaseEncodingSteps",
                    "value": 320
                },
                {
                    "field": "PhaseOversampling",
                    "value": 10
                },
                {
                    "field": "MagneticFieldStrength",
                    "value": 3
                },
                {
                    "field": "ImagingFrequency",
                    "value": 123.254038
                },
                {
                    "field": "ImagedNucleus",
                    "value": "1H"
                },
                {
                    "field": "TransmitCoilName",
                    "value": "Body"
                },
                {
                    "field": "ReceiveCoilName",
                    "value": "HEA;HEP"
                },
                {
                    "field": "PercentSampling",
                    "value": 100
                },
                {
                    "field": "PercentPhaseFieldOfView",
                    "value": 100.0
                },
                {
                    "field": "AcquisitionDuration",
                    "value": 504
                },
                {
                    "field": "NumberOfSlabGroups",
                    "value": 1
                },
                {
                    "field": "SlabsPerGroup",
                    "value": 1
                },
                {
                    "field": "SlicesPerSlab",
                    "value": 256
                },
                {
                    "field": "ImageOrientationPatient",
                    "value": "Sagittal"
                },
                {
                    "field": "ScanningSequence",
                    "value": [
                        "SE"
                    ]
                },
                {
                    "field": "SequenceVariant",
                    "value": [
                        "SK",
                        "SP"
                    ]
                },
                {
                    "field": "ParallelAcquisitionTechnique",
                    "value": "GRAPPA"
                },
                {
                    "field": "ParallelReductionFactorInPlane",
                    "value": 2
                },
                {
                    "field": "ParallelReductionFactorOutOfPlane",
                    "value": 1
                },
                {
                    "field": "GRAPPAKernelSize",
                    "value": 32
                },
                {
                    "field": "PartialFourier",
                    "value": "Allowed"
                },
                {
                    "field": "SliceResolution",
                    "value": 100
                },
                {
                    "field": "AutoAlign",
                    "value": "Head > Brain"
                },
                {
                    "field": "PatientPosition",
                    "value": "Isocenter"
                },
                {
                    "field": "CoilCombineMode",
                    "value": "Adaptive Combine"
                },
                {
                    "field": "AveragingMode",
                    "value": "Long term"
                },
                {
                    "field": "GradientMode",
                    "value": "Fast"
                },
                {
                    "field": "RFPulseType",
                    "value": "Fast"
                },
                {
                    "field": "Excitation",
                    "value": "Non-sel."
                },
                {
                    "field": "EllipticalScanning",
                    "value": "Off"
                },
                {
                    "field": "Reordering",
                    "value": "Linear"
                },
                {
                    "field": "AdiabaticMode",
                    "value": "Off"
                },
                {
                    "field": "PrescanNormalize",
                    "value": "Off"
                },
                {
                    "field": "MultipleSeriesMode",
                    "value": "Each measurement"
                },
                {
                    "field": "ShimMode",
                    "value": "Standard"
                },
                {
                    "field": "AutoCoilSelect",
                    "value": "Default"
                },
                {
                    "field": "RestoreMagnetization",
                    "value": "Off"
                }
            ],
            "series": [
                {
                    "name": "1",
                    "fields": [
                        {
                            "field": "ImageType",
                            "value": [
                                "ORIGINAL",
                                "PRIMARY",
                                "M",
                                "ND"
                            ]
                        },
                        {
                            "field": "SeriesNumber",
                            "value": 1
                        }
                    ]
                }
            ]
        }
    }
}