{
    "name": "HCP BIAS_BC",
    "description": "Human Connectome Project Structural Session BIAS_BC scan (Body Coil bias field measurement)",
    "authors": [
        "WU-Minn Consortium"
    ],
    "acquisitions": {
        "acq-bias-bc": {
            "fields": [
                {
                    "field": "SeriesDescription",
                    "value": "BIAS_BC"
                },
                {
                    "field": "Manufacturer",
                    "value": "SIEMENS"
                },
                {
                    "field": "ManufacturerModelName",
                    "value": "MAGNETOM ConnectomS"
                },
                {
                    "field": "SoftwareVersions",
                    "value": "syngo MR D11"
                },
                {
                    "field": "MRAcquisitionType",
                    "value": "3D"
                },
                {
                    "field": "SliceThickness",
                    "value": 2.00
                },
                {
                    "field": "PixelSpacing",
                    "value": [
                        2.0,
                        2.0
                    ]
                },
                {
                    "field": "Rows",
                    "value": 112
                },
                {
                    "field": "Columns",
                    "value": 112
                },
                {
                    "field": "AcquisitionMatrix",
                    "value": [
                        0,
                        112,
                        112,
                        0
                    ]
                },
                {
                    "field": "RepetitionTime",
                    "value": 250.0
                },
                {
                    "field": "EchoTime",
                    "value": 1.01
                },
                {
                    "field": "FlipAngle",
                    "value": 3
                },
                {
                    "field": "EchoSpacing",
                    "value": 3
                },
                {
                    "field": "TurboFactor",
                    "value": 78
                },
                {
                    "field": "PixelBandwidth",
                    "value": 540
                },
                {
                    "field": "InPlanePhaseEncodingDirection",
                    "value": "COL"
                },
                {
                    "field": "PhaseEncodingDirectionPositive",
                    "value": [
                        0
                    ]
                },
                {
                    "field": "NumberOfPhaseEncodingSteps",
                    "value": 112
                },
                {
                    "field": "MagneticFieldStrength",
                    "value": 3
                },
                {
                    "field": "ImagingFrequency",
                    "value": 123.254038
                },
                {
                    "field": "ImagedNucleus",
                    "value": "1H"
                },
                {
                    "field": "TransmitCoilName",
                    "value": "Body"
                },
                {
                    "field": "ReceiveCoilName",
                    "value": "BC"
                },
                {
                    "field": "NumberOfAverages",
                    "value": 1
                },
                {
                    "field": "PercentSampling",
                    "value": 100
                },
                {
                    "field": "PercentPhaseFieldOfView",
                    "value": 100.0
                },
                {
                    "field": "AcquisitionDuration",
                    "value": 23
                },
                {
                    "field": "NumberOfSlabGroups",
                    "value": 1
                },
                {
                    "field": "SlabsPerGroup",
                    "value": 1
                },
                {
                    "field": "SlicesPerSlab",
                    "value": 88
                },
                {
                    "field": "SliceSpacing",
                    "value": 3.0
                },
                {
                    "field": "SliceOversampling",
                    "value": 18.2
                },
                {
                    "field": "ImageOrientationPatient",
                    "value": "Sagittal"
                },
                {
                    "field": "MultiSliceMode",
                    "value": "Single shot"
                },
                {
                    "field": "ScanningSequence",
                    "value": [
                        "GR"
                    ]
                },
                {
                    "field": "SequenceVariant",
                    "value": [
                        "SP"
                    ]
                },
                {
                    "field": "PartialFourier",
                    "value": 0.75
                },
                {
                    "field": "SlicePartialFourier",
                    "value": 0.75
                },
                {
                    "field": "SliceResolution",
                    "value": 100
                },
                {
                    "field": "AsymmetricEcho",
                    "value": "Allowed"
                },
                {
                    "field": "AutoAlign",
                    "value": "Head > Brain"
                },
                {
                    "field": "PatientPosition",
                    "value": "Isocenter"
                },
                {
                    "field": "CoilCombineMode",
                    "value": "Sum of Squares"
                },
                {
                    "field": "RFSpoiling",
                    "value": "On"
                },
                {
                    "field": "AveragingMode",
                    "value": "Long term"
                },
                {
                    "field": "GradientMode",
                    "value": "Fast*"
                },
                {
                    "field": "RFPulseType",
                    "value": "Fast"
                },
                {
                    "field": "Excitation",
                    "value": "Non-sel."
                },
                {
                    "field": "EllipticalScanning",
                    "value": "Off"
                },
                {
                    "field": "Reordering",
                    "value": "Linear"
                },
                {
                    "field": "PrescanNormalize",
                    "value": "Off"
                },
                {
                    "field": "MultipleSeriesMode",
                    "value": "Each measurement"
                }
            ],
            "series": [
                {
                    "name": "1",
                    "fields": [
                        {
                            "field": "ImageType",
                            "value": [
                                "ORIGINAL",
                                "PRIMARY",
                                "M",
                                "ND"
                            ]
                        },
                        {
                            "field": "SeriesNumber",
                            "value": 1
                        }
                    ]
                }
            ]
        }
    }
}